{
  "$schema": "https://json-schema.org/draft/2020-12/schema",
  "$id": "https://sounio.org/hardware/spec/eisa_h/pireus_admission_cross_engine_v1.schema.json",
  "title": "EISA-H PIREUS admission cross-engine agreement contract",
  "type": "object",
  "additionalProperties": false,
  "required": [
    "schema_version",
    "contract_id",
    "purpose",
    "provenance",
    "algebra",
    "encoding",
    "declared",
    "obligations",
    "error_codes",
    "receipt",
    "claim_boundary"
  ],
  "properties": {
    "schema_version": { "const": 1 },
    "contract_id": { "const": "eisa_h.pireus_admission_cross_engine.v1" },
    "purpose": { "type": "string" },
    "provenance": { "type": "object" },
    "algebra": { "type": "object" },
    "encoding": { "type": "object" },
    "declared": { "type": "object" },
    "obligations": { "type": "array" },
    "error_codes": { "type": "array" },
    "receipt": { "type": "object" },
    "claim_boundary": { "type": "object" }
  }
}
